{
  "adjudication_id": "adj-001",
  "artifact_type": "AdjudicationRecord.v1",
  "blinded": true,
  "conflict_of_interest_declared": false,
  "created_at": "2026-07-24T13:00:00Z",
  "disagreement": false,
  "escalation": false,
  "evidence_refs": [],
  "independence_declared": true,
  "integrity": {
    "artifact_digest": "sha256:86f586ae5b592104734272f11cdfa141a104fd2c11f4485b6c2f0e7ab35a5dc4",
    "canonicalization_version": "v1"
  },
  "label": "valid",
  "label_released_at": "2026-07-24T14:00:00Z",
  "producer": "pcs-core",
  "producer_version": "0.1.0",
  "protected_rationale": {
    "commitment_digest": "sha256:aaaaaaaaaaaaaaaaaaaaaaaaaaaaaaaaaaaaaaaaaaaaaaaaaaaaaaaaaaaaaaaa",
    "content_omitted": true,
    "location_class": "access_controlled_store"
  },
  "protocol_id": "adj-protocol",
  "protocol_version": "1.0.0",
  "schema_version": "v1",
  "source_commit": "e068794683959c52a19594a6d271dd5e69f3c999",
  "source_repo": "https://github.com/SentinelOps-CI/pcs-core",
  "subject": {
    "artifact_digest": "sha256:eeeeeeeeeeeeeeeeeeeeeeeeeeeeeeeeeeeeeeeeeeeeeeeeeeeeeeeeeeeeeeee",
    "artifact_id": "vr-001",
    "artifact_type": "VerificationResult.v1"
  },
  "votes": [
    {
      "role": "primary",
      "vote": "valid",
      "voter_pseudonym_id": "voter-a"
    }
  ]
}
